{
  "name": "L ToLOVEるダークネス",
  "type": "AT",
  "roles": [
    {
      "name": "左チャンス目",
      "probabilities": {
        "L": 0.03125,
        "2": 0.03125,
        "3": 0.03125,
        "4": 0.03125,
        "5": 0.03125,
        "6": 0.03125
      },
      "hasSettingDiff": false,
      "displayOrder": 1,
      "color": "#E91E63",
      "description": "全設定共通: 1/32.0"
    },
    {
      "name": "中チャンス目",
      "probabilities": {
        "L": 0.025,
        "2": 0.025,
        "3": 0.025,
        "4": 0.025,
        "5": 0.025,
        "6": 0.025
      },
      "hasSettingDiff": false,
      "displayOrder": 2,
      "color": "#FF9800",
      "description": "全設定共通: 1/40.0"
    },
    {
      "name": "右チャンス目",
      "probabilities": {
        "L": 0.014706,
        "2": 0.014706,
        "3": 0.014706,
        "4": 0.014706,
        "5": 0.014706,
        "6": 0.014706
      },
      "hasSettingDiff": false,
      "displayOrder": 3,
      "color": "#4CAF50",
      "description": "全設定共通: 1/68.0"
    },
    {
      "name": "複合チャンス目合算",
      "probabilities": {
        "L": 0.005859,
        "2": 0.005859,
        "3": 0.005859,
        "4": 0.005859,
        "5": 0.005859,
        "6": 0.005859
      },
      "hasSettingDiff": false,
      "displayOrder": 4,
      "color": "#9C27B0",
      "description": "全設定共通: 1/170.7（左中/左右/中右 各1/512）"
    },
    {
      "name": "ハーレム目",
      "probabilities": {
        "L": 0.000183,
        "2": 0.000183,
        "3": 0.000183,
        "4": 0.000183,
        "5": 0.000183,
        "6": 0.000183
      },
      "hasSettingDiff": false,
      "displayOrder": 5,
      "color": "#F44336",
      "description": "全設定共通: 1/5461.3（左中右全停止）"
    }
  ],
  "confirmationEvents": [
    {
      "id": "stamp_yoshi",
      "name": "ST終了画面 吉スタンプ",
      "description": "ハルルナスタンプ出現時",
      "confirmedSettings": [
        "3",
        "4",
        "5",
        "6"
      ],
      "excludedSettings": [
        "L",
        "2"
      ],
      "color": "#4CAF50"
    },
    {
      "id": "stamp_ryou",
      "name": "ST終了画面 良スタンプ",
      "description": "ハルルナスタンプ出現時",
      "confirmedSettings": [
        "4",
        "5",
        "6"
      ],
      "excludedSettings": [
        "L",
        "2",
        "3"
      ],
      "color": "#FFD700"
    },
    {
      "id": "stamp_yuu",
      "name": "ST終了画面 優スタンプ",
      "description": "ハルルナスタンプ出現時",
      "confirmedSettings": [
        "5",
        "6"
      ],
      "excludedSettings": [
        "L",
        "2",
        "3",
        "4"
      ],
      "color": "#FF9800"
    },
    {
      "id": "stamp_goku",
      "name": "ST終了画面 極スタンプ",
      "description": "ハルルナスタンプ出現時",
      "confirmedSettings": [
        "6"
      ],
      "excludedSettings": [
        "L",
        "2",
        "3",
        "4",
        "5"
      ],
      "color": "#E91E63"
    },
    {
      "id": "display_456",
      "name": "獲得枚数表示 456枚OVER",
      "description": "ST終了時の枚数表示",
      "confirmedSettings": [
        "4",
        "5",
        "6"
      ],
      "excludedSettings": [
        "L",
        "2",
        "3"
      ],
      "color": "#FFD700"
    },
    {
      "id": "display_555",
      "name": "獲得枚数表示 555枚OVER",
      "description": "ST終了時の枚数表示",
      "confirmedSettings": [
        "5",
        "6"
      ],
      "excludedSettings": [
        "L",
        "2",
        "3",
        "4"
      ],
      "color": "#FF9800"
    },
    {
      "id": "display_666",
      "name": "獲得枚数表示 666枚OVER",
      "description": "ST終了時の枚数表示",
      "confirmedSettings": [
        "6"
      ],
      "excludedSettings": [
        "L",
        "2",
        "3",
        "4",
        "5"
      ],
      "color": "#E91E63"
    },
    {
      "id": "panel_off",
      "name": "待機中パネル消灯",
      "description": "待機状態中に筐体上下パネル消灯",
      "confirmedSettings": [
        "L"
      ],
      "excludedSettings": [
        "2",
        "3",
        "4",
        "5",
        "6"
      ],
      "color": "#9E9E9E"
    }
  ],
  "endScreens": [
    {
      "id": "end_mikan",
      "name": "ST終了画面 美柑",
      "type": "st_end",
      "hint": "高設定示唆"
    },
    {
      "id": "stamp_yoshi",
      "name": "ST終了画面 吉スタンプ",
      "type": "at_end",
      "hint": "設定3以上濃厚",
      "color": "#4CAF50"
    },
    {
      "id": "stamp_ryou",
      "name": "ST終了画面 良スタンプ",
      "type": "at_end",
      "hint": "ハルルナスタンプ出現時",
      "color": "#FFD700"
    },
    {
      "id": "stamp_yuu",
      "name": "ST終了画面 優スタンプ",
      "type": "at_end",
      "hint": "ハルルナスタンプ出現時",
      "color": "#FF9800"
    },
    {
      "id": "stamp_goku",
      "name": "ST終了画面 極スタンプ",
      "type": "at_end",
      "hint": "設定6濃厚",
      "color": "#E91E63"
    },
    {
      "id": "panel_off",
      "name": "待機中パネル消灯",
      "type": "at_end",
      "hint": "設定L濃厚",
      "color": "#9E9E9E"
    }
  ],
  "voiceCounts": [
    {
      "id": "nagi_white",
      "name": "隠れ凪ボイス 白枠",
      "description": "1000G消化ごとのQR読み取り",
      "hint": "デフォルト",
      "color": "#FFFFFF"
    },
    {
      "id": "nagi_blue",
      "name": "隠れ凪ボイス 青枠「一味違いますね」",
      "description": "1000G消化ごとのQR読み取り",
      "hint": "設定2以上",
      "color": "#2196F3"
    },
    {
      "id": "nagi_green",
      "name": "隠れ凪ボイス 緑枠「不思議な気配です」",
      "description": "1000G消化ごとのQR読み取り",
      "hint": "設定3以上濃厚",
      "color": "#4CAF50"
    },
    {
      "id": "nagi_red",
      "name": "隠れ凪ボイス 赤枠「良い予感がします」",
      "description": "1000G消化ごとのQR読み取り",
      "hint": "設定4以上濃厚",
      "color": "#F44336"
    },
    {
      "id": "nagi_silver",
      "name": "隠れ凪ボイス 銀枠「遊び尽くしちゃいましょう」",
      "description": "1000G消化ごとのQR読み取り",
      "hint": "設定5以上濃厚",
      "color": "#9E9E9E"
    },
    {
      "id": "nagi_gold",
      "name": "隠れ凪ボイス 金枠「お肉～♪」",
      "description": "1000G消化ごとのQR読み取り",
      "hint": "設定6濃厚",
      "color": "#FFD700"
    }
  ],
  "trialSuccessRates": [
    {
      "id": "at_rate",
      "name": "AT初当たり確率",
      "description": "設定2: 1/352.0、設定6: 1/311.1。設定Lはデータ非公開",
      "probabilities": {
        "2": 0.002841,
        "3": 0.002893,
        "4": 0.003045,
        "5": 0.003212,
        "6": 0.003214,
        "L": 0
      },
      "color": "#2196F3",
      "displayOrder": 1
    },
    {
      "id": "harem_whisper",
      "name": "ハーレムモード中ウィスパー演出選択率",
      "description": "設定2: 3.1%、設定6: 11.9%。大きな設定差",
      "probabilities": {
        "2": 0.031,
        "3": 0.036,
        "4": 0.06,
        "5": 0.071,
        "6": 0.119,
        "L": 0
      },
      "color": "#FF9800",
      "displayOrder": 2
    }
  ],
  "description": "SANKYO製スマスロAT機。設定L,2,3,4,5,6の6段階（設定1非搭載）。チェリー・スイカは存在せずチャンス目のみの独自役構成。小役確率は全設定共通。AT初当たり確率とハーレムモード中ウィスパー演出選択率に設定差。ST終了画面・隠れ凪ボイスで設定示唆。",
  "author": "コミュニティ",
  "version": "1.3",
  "lastUpdated": "2026-03-27",
  "source": "ちょんぼりすた、一撃、ななプレス、DMMぱちタウン",
  "availableSettings": [
    "L",
    "2",
    "3",
    "4",
    "5",
    "6"
  ]
}
