{
  "name": "スマスロ 沖ドキ!DUO アンコール",
  "type": "AT",
  "roles": [
    {
      "name": "角チェリー",
      "probabilities": {
        "1": 0.02137,
        "2": 0.02222,
        "3": 0.02309,
        "5": 0.02398,
        "6": 0.02481
      },
      "hasSettingDiff": true,
      "displayOrder": 1,
      "color": "#F44336",
      "description": "設定1: 1/46.8、設定6: 1/40.3。5段階設定（設定4なし）"
    },
    {
      "name": "確定役",
      "probabilities": {
        "1": 0.000229,
        "2": 0.000229,
        "3": 0.000229,
        "5": 0.000229,
        "6": 0.000229
      },
      "hasSettingDiff": false,
      "displayOrder": 2,
      "color": "#C2185B",
      "description": "全設定共通: 1/4369.1"
    },
    {
      "name": "スイカ",
      "probabilities": {
        "1": 0.00696,
        "2": 0.00696,
        "3": 0.00696,
        "5": 0.00696,
        "6": 0.00696
      },
      "hasSettingDiff": false,
      "displayOrder": 3,
      "color": "#4CAF50",
      "description": "全設定共通: 1/143.7"
    }
  ],
  "confirmationEvents": [
    {
      "id": "tempai_kirarin",
      "name": "テンパイ音「きらりーん」",
      "description": "リール停止時テンパイ音",
      "confirmedSettings": [
        "2",
        "3",
        "5",
        "6"
      ],
      "excludedSettings": [
        "1"
      ],
      "color": "#795548"
    },
    {
      "id": "tempai_pikon_voice",
      "name": "テンパイ音「ぴこーん（ボイス版）」",
      "description": "リール停止時テンパイ音",
      "confirmedSettings": [
        "3",
        "5",
        "6"
      ],
      "excludedSettings": [
        "1",
        "2"
      ],
      "color": "#FFD700"
    },
    {
      "id": "tempai_zutto",
      "name": "テンパイ音「私、あなたのことが...ずっと」",
      "description": "リール停止時テンパイ音",
      "confirmedSettings": [
        "5",
        "6"
      ],
      "excludedSettings": [
        "1",
        "2",
        "3"
      ],
      "color": "#FF9800"
    },
    {
      "id": "tempai_3nin",
      "name": "テンパイ音「今日は3人で楽しもー！」",
      "description": "リール停止時テンパイ音",
      "confirmedSettings": [
        "6"
      ],
      "excludedSettings": [
        "1",
        "2",
        "3",
        "5"
      ],
      "color": "#E91E63"
    }
  ],
  "trialSuccessRates": [
    {
      "id": "bonus_rate",
      "name": "ボーナス初当たり確率",
      "description": "設定1: 1/240.0、設定6: 1/181.0",
      "probabilities": {
        "1": 0.004167,
        "2": 0.004344,
        "3": 0.004634,
        "5": 0.005205,
        "6": 0.005525
      },
      "color": "#2196F3",
      "displayOrder": 1
    }
  ],
  "endScreens": [
    {
      "id": "default",
      "name": "通常画面",
      "type": "at_end",
      "hint": "基本パターン"
    }
  ],
  "voiceCounts": [
    {
      "id": "tempai_normal",
      "name": "通常テンパイ音",
      "hint": "基本パターン"
    },
    {
      "id": "tempai_special",
      "name": "特殊テンパイ音",
      "hint": "天国以上濃厚"
    }
  ],
  "author": "コミュニティ",
  "version": "1.2",
  "lastUpdated": "2026-03-25",
  "source": "ちょんぼりすた、一撃、ナナプレス",
  "availableSettings": [
    "1",
    "2",
    "3",
    "5",
    "6"
  ]
}
