{
  "name": "Lパチスロ バイオハザードRE:3",
  "type": "AT",
  "roles": [
    {
      "name": "ベル",
      "hasSettingDiff": false,
      "displayOrder": 1,
      "color": "#FFC107",
      "description": "設定1: 1/3.2、設定6: 1/3.2",
      "probabilities": {
        "1": 0.3125,
        "2": 0.3125,
        "3": 0.3125,
        "4": 0.3125,
        "5": 0.3125,
        "6": 0.3125
      }
    },
    {
      "name": "リプレイ",
      "hasSettingDiff": false,
      "displayOrder": 2,
      "color": "#2196F3",
      "description": "設定1: 1/8.1、設定6: 1/8.1",
      "probabilities": {
        "1": 0.123457,
        "2": 0.123457,
        "3": 0.123457,
        "4": 0.123457,
        "5": 0.123457,
        "6": 0.123457
      }
    },
    {
      "name": "スイカ",
      "hasSettingDiff": false,
      "displayOrder": 3,
      "color": "#4CAF50",
      "description": "設定1: 1/65.5、設定6: 1/65.5",
      "probabilities": {
        "1": 0.0152672,
        "2": 0.0152672,
        "3": 0.0152672,
        "4": 0.0152672,
        "5": 0.0152672,
        "6": 0.0152672
      }
    },
    {
      "name": "弱チェリー",
      "hasSettingDiff": false,
      "displayOrder": 4,
      "color": "#E91E63",
      "description": "設定1: 1/87.4、設定6: 1/87.4",
      "probabilities": {
        "1": 0.0114416,
        "2": 0.0114416,
        "3": 0.0114416,
        "4": 0.0114416,
        "5": 0.0114416,
        "6": 0.0114416
      }
    },
    {
      "name": "強チェリー",
      "hasSettingDiff": false,
      "displayOrder": 5,
      "color": "#F44336",
      "description": "設定1: 1/399.6、設定6: 1/399.6",
      "probabilities": {
        "1": 0.0025025,
        "2": 0.0025025,
        "3": 0.0025025,
        "4": 0.0025025,
        "5": 0.0025025,
        "6": 0.0025025
      }
    },
    {
      "name": "チャンス目",
      "hasSettingDiff": false,
      "displayOrder": 6,
      "color": "#FF9800",
      "description": "設定1: 1/399.6、設定6: 1/399.6",
      "probabilities": {
        "1": 0.0025025,
        "2": 0.0025025,
        "3": 0.0025025,
        "4": 0.0025025,
        "5": 0.0025025,
        "6": 0.0025025
      }
    },
    {
      "name": "5枚ベル",
      "probabilities": {
        "1": 0.05,
        "2": 0.0518135,
        "3": 0.0537634,
        "4": 0.0555556,
        "5": 0.0581395,
        "6": 0.0628931
      },
      "description": "設定1: 1/20.0、設定6: 1/15.9",
      "hasSettingDiff": true,
      "color": "#FFC107",
      "displayOrder": 7
    },
    {
      "name": "CZ突入率",
      "probabilities": {
        "1": 0.00697837,
        "2": 0.00713776,
        "3": 0.00758725,
        "4": 0.00820345,
        "5": 0.00904159,
        "6": 0.00946074
      },
      "description": "設定1: 1/143.3、設定6: 1/105.7",
      "hasSettingDiff": true,
      "color": "#FF9800",
      "displayOrder": 8
    }
  ],
  "confirmationEvents": [
    {
      "name": "獲得枚数表示 222over",
      "id": "ce_f714117ec8",
      "confirmedSettings": [
        "2",
        "3",
        "4",
        "5",
        "6"
      ],
      "excludedSettings": [],
      "description": "設定2・3・4・5・6を示す。"
    },
    {
      "name": "獲得枚数表示 333over",
      "id": "ce_005f23ebdd",
      "confirmedSettings": [
        "3",
        "4",
        "5",
        "6"
      ],
      "excludedSettings": [],
      "description": "設定3・4・5・6を示す。"
    },
    {
      "name": "獲得枚数表示 444over",
      "id": "ce_59552a700e",
      "confirmedSettings": [
        "4",
        "5",
        "6"
      ],
      "excludedSettings": [],
      "description": "設定4・5・6を示す。"
    },
    {
      "name": "獲得枚数表示 555over",
      "id": "ce_85dec4aa6f",
      "confirmedSettings": [
        "5",
        "6"
      ],
      "excludedSettings": [],
      "description": "設定5・6を示す。"
    },
    {
      "name": "獲得枚数表示 666枚over",
      "id": "ce_c0cae84d5d",
      "confirmedSettings": [
        "6"
      ],
      "excludedSettings": [],
      "description": "設定6を示す。"
    }
  ],
  "endScreens": [
    {
      "name": "エンタトロフィー 銅",
      "id": "es_413ef32c61",
      "hint": "解析サイトで確認された画面。数値の出現率・確定設定は登録していない。",
      "description": "解析サイトで確認された画面。数値の出現率・確定設定は登録していない。",
      "type": "at_end"
    },
    {
      "name": "エンタトロフィー 銀",
      "id": "es_415b5801b8",
      "hint": "解析サイトで確認された画面。数値の出現率・確定設定は登録していない。",
      "description": "解析サイトで確認された画面。数値の出現率・確定設定は登録していない。",
      "type": "at_end"
    },
    {
      "name": "エンタトロフィー 金",
      "id": "es_ceb1424bd1",
      "hint": "解析サイトで確認された画面。数値の出現率・確定設定は登録していない。",
      "description": "解析サイトで確認された画面。数値の出現率・確定設定は登録していない。",
      "type": "at_end"
    },
    {
      "name": "エンタトロフィー 紅葉柄",
      "id": "es_ece6d84cdd",
      "hint": "解析サイトで確認された画面。数値の出現率・確定設定は登録していない。",
      "description": "解析サイトで確認された画面。数値の出現率・確定設定は登録していない。",
      "type": "at_end"
    },
    {
      "name": "エンタトロフィー 虹",
      "id": "es_804a4ca536",
      "hint": "解析サイトで確認された画面。数値の出現率・確定設定は登録していない。",
      "description": "解析サイトで確認された画面。数値の出現率・確定設定は登録していない。",
      "type": "at_end"
    },
    {
      "name": "フィギュア No.1 ゾンビ(男)",
      "id": "es_ba5d4f1b71",
      "hint": "奇数設定示唆（弱）",
      "description": "奇数設定示唆（弱）。確定・否定の設定や数値の出現率は登録していない。",
      "type": "other"
    },
    {
      "name": "フィギュア No.2 ゾンビ(女)",
      "id": "es_3b53a702ed",
      "hint": "奇数設定示唆（弱）",
      "description": "奇数設定示唆（弱）。確定・否定の設定や数値の出現率は登録していない。",
      "type": "other"
    },
    {
      "name": "フィギュア No.3 ハンターβ",
      "id": "es_2178880a9c",
      "hint": "奇数設定示唆（強）",
      "description": "奇数設定示唆（強）。確定・否定の設定や数値の出現率は登録していない。",
      "type": "other"
    },
    {
      "name": "フィギュア No.4 ハンターγ",
      "id": "es_0e69121bc4",
      "hint": "奇数設定示唆（強）",
      "description": "奇数設定示唆（強）。確定・否定の設定や数値の出現率は登録していない。",
      "type": "other"
    },
    {
      "name": "フィギュア No.5 ジル・バレンタイン",
      "id": "es_1c23955acb",
      "hint": "偶数設定示唆（弱）",
      "description": "偶数設定示唆（弱）。確定・否定の設定や数値の出現率は登録していない。",
      "type": "other"
    },
    {
      "name": "フィギュア No.6 カルロス・オリヴェイラ",
      "id": "es_b8bdef0254",
      "hint": "偶数設定示唆（弱）",
      "description": "偶数設定示唆（弱）。確定・否定の設定や数値の出現率は登録していない。",
      "type": "other"
    },
    {
      "name": "フィギュア No.7 ミハイル・ヴィクトール",
      "id": "es_706b658973",
      "hint": "偶数設定示唆（強）",
      "description": "偶数設定示唆（強）。確定・否定の設定や数値の出現率は登録していない。",
      "type": "other"
    },
    {
      "name": "フィギュア No.8 タイレル・パトリック",
      "id": "es_80ff7d008f",
      "hint": "偶数設定示唆（強）",
      "description": "偶数設定示唆（強）。確定・否定の設定や数値の出現率は登録していない。",
      "type": "other"
    },
    {
      "name": "フィギュア No.9 ネメシス 第一形態",
      "id": "es_9e89135913",
      "hint": "高設定示唆（弱）",
      "description": "高設定示唆（弱）。確定・否定の設定や数値の出現率は登録していない。",
      "type": "other"
    },
    {
      "name": "フィギュア No.10 ブラッド・ヴィッカーズ",
      "id": "es_f5817ba0db",
      "hint": "高設定示唆（弱）",
      "description": "高設定示唆（弱）。確定・否定の設定や数値の出現率は登録していない。",
      "type": "other"
    },
    {
      "name": "フィギュア No.11 ネメシス 第二形態",
      "id": "es_4bc3c09e30",
      "hint": "高設定示唆（中）",
      "description": "高設定示唆（中）。確定・否定の設定や数値の出現率は登録していない。",
      "type": "other"
    },
    {
      "name": "フィギュア No.12 ニコライ・ジノビエフ",
      "id": "es_033bbd1206",
      "hint": "高設定示唆（中）",
      "description": "高設定示唆（中）。確定・否定の設定や数値の出現率は登録していない。",
      "type": "other"
    },
    {
      "name": "フィギュア No.13 ネメシス 第三形態",
      "id": "es_0229b14b42",
      "hint": "高設定示唆（強）",
      "description": "高設定示唆（強）。確定・否定の設定や数値の出現率は登録していない。",
      "type": "other"
    },
    {
      "name": "フィギュア No.14 チャーリーくん",
      "id": "es_fd9c779740",
      "confirmedSettings": [],
      "excludedSettings": [
        "1"
      ],
      "description": "設定1を否定。",
      "type": "other"
    },
    {
      "name": "フィギュア No.15 ジル(感染)・No.16 カルロス(感染) の2体セット",
      "id": "es_dabd75ab1d",
      "confirmedSettings": [
        "4",
        "5",
        "6"
      ],
      "excludedSettings": [],
      "description": "設定4・5・6を示す。",
      "type": "other"
    }
  ],
  "trialSuccessRates": [
    {
      "id": "at_first_hit",
      "name": "AT初当たり確率",
      "description": "設定1: 1/399.0、設定6: 1/311.2",
      "displayOrder": 1,
      "color": "#E91E63",
      "probabilities": {
        "1": 0.00250627,
        "2": 0.00255493,
        "3": 0.0026824,
        "4": 0.00285878,
        "5": 0.00309119,
        "6": 0.00321337
      }
    }
  ],
  "notes": "全設定の値がそろわない項目・単一出典で採用条件を満たさない項目は登録していない。",
  "author": "コミュニティ",
  "version": "1.2",
  "lastUpdated": "2026-09-30",
  "source": "ちょんぼりすた(https://chonborista.com/slot/enta-slot/253191/)、DMMぱちタウン(https://p-town.dmm.com/machines/4974)、なな徹(https://nana-press.com/kaiseki/machine/1140/)",
  "description": "Lパチスロ バイオハザードRE:3の解析データ。8個の役、5個の確定演出、20個の終了画面、1個の試行成功率を出典付きで登録。",
  "zones": [
    {
      "name": "AT中",
      "isDefault": false,
      "roles": [
        {
          "name": "CZ突入率",
          "probabilities": {
            "1": 0.00448833,
            "2": 0.00461467,
            "3": 0.0049554,
            "4": 0.0053135,
            "5": 0.0059312,
            "6": 0.00621891
          },
          "description": "設定1: 1/222.8、設定6: 1/160.8",
          "hasSettingDiff": true,
          "color": "#FF9800",
          "displayOrder": 1
        }
      ],
      "description": "AT中のゲーム数を分母にして数える。"
    },
    {
      "name": "上位AT中",
      "isDefault": false,
      "roles": [
        {
          "name": "CZ突入率",
          "probabilities": {
            "1": 0.00815661,
            "2": 0.00852515,
            "3": 0.00902527,
            "4": 0.00979432,
            "5": 0.0105263,
            "6": 0.0113379
          },
          "description": "設定1: 1/122.6、設定6: 1/88.2",
          "hasSettingDiff": true,
          "color": "#FF9800",
          "displayOrder": 1
        }
      ],
      "description": "上位AT中のゲーム数を分母にして数える。"
    }
  ]
}
