{
  "name": "Lゾンビランドサガ",
  "type": "AT",
  "roles": [
    {
      "name": "SAGA揃い（低確時）",
      "probabilities": {
        "1": 0.027855,
        "2": 0.028249,
        "3": 0.029499,
        "4": 0.030769,
        "5": 0.032787,
        "6": 0.034247
      },
      "hasSettingDiff": true,
      "displayOrder": 1,
      "color": "#7C4DFF",
      "description": "設定1: 1/35.9、設定6: 1/29.2。低確/高確の判別が困難なため参考値"
    },
    {
      "name": "ST確率",
      "probabilities": {
        "1": 0.001889,
        "2": 0.001941,
        "3": 0.002076,
        "4": 0.002469,
        "5": 0.002682,
        "6": 0.002834
      },
      "hasSettingDiff": true,
      "displayOrder": 2,
      "color": "#FF9800",
      "description": "設定1: 1/529.3、設定6: 1/352.8"
    },
    {
      "name": "CZ合算確率",
      "probabilities": {
        "1": 0.005086,
        "2": 0.005165,
        "3": 0.005379,
        "4": 0.005708,
        "5": 0.00605,
        "6": 0.006357
      },
      "hasSettingDiff": true,
      "displayOrder": 3,
      "color": "#4CAF50",
      "description": "設定1: 1/196.6、設定6: 1/157.3（待て!ロメロ除く）"
    },
    {
      "name": "ST直撃確率",
      "probabilities": {
        "1": 0.000191,
        "2": 0.000209,
        "3": 0.000259,
        "4": 0.000344,
        "5": 0.000372,
        "6": 0.000388
      },
      "hasSettingDiff": true,
      "displayOrder": 4,
      "color": "#F44336",
      "description": "設定1: 1/5226、設定6: 1/2577。複数回確認で高設定期待大"
    }
  ],
  "confirmationEvents": [
    {
      "id": "adabana_saki",
      "name": "徒花ボーナス中キャラ サキ",
      "description": "徒花ボーナス中キャラ紹介でサキが出現で設定2以上濃厚",
      "confirmedSettings": [
        "2",
        "3",
        "4",
        "5",
        "6"
      ],
      "excludedSettings": [
        "1"
      ],
      "color": "#F44336"
    },
    {
      "id": "adabana_ai",
      "name": "徒花ボーナス中キャラ 愛",
      "description": "徒花ボーナス中キャラ紹介で愛が出現で設定3以上濃厚",
      "confirmedSettings": [
        "3",
        "4",
        "5",
        "6"
      ],
      "excludedSettings": [
        "1",
        "2"
      ],
      "color": "#2196F3"
    },
    {
      "id": "adabana_junko",
      "name": "徒花ボーナス中キャラ 純子",
      "description": "徒花ボーナス中キャラ紹介で純子が出現で設定4以上濃厚",
      "confirmedSettings": [
        "4",
        "5",
        "6"
      ],
      "excludedSettings": [
        "1",
        "2",
        "3"
      ],
      "color": "#9C27B0"
    },
    {
      "id": "adabana_yugiri",
      "name": "徒花ボーナス中キャラ ゆうぎり",
      "description": "徒花ボーナス中キャラ紹介でゆうぎりが出現で設定5以上濃厚",
      "confirmedSettings": [
        "5",
        "6"
      ],
      "excludedSettings": [
        "1",
        "2",
        "3",
        "4"
      ],
      "color": "#E91E63"
    },
    {
      "id": "adabana_lily",
      "name": "徒花ボーナス中キャラ リリィ",
      "description": "徒花ボーナス中キャラ紹介でリリィが出現で設定6濃厚",
      "confirmedSettings": [
        "6"
      ],
      "excludedSettings": [
        "1",
        "2",
        "3",
        "4",
        "5"
      ],
      "color": "#FFD700"
    },
    {
      "id": "ed_voice_mottoru",
      "name": "ED中ボイス「俺がもっとるんじゃーい」",
      "description": "エンディング中に幸太郎「俺がもっとるんじゃーい」ボイスで設定4以上濃厚",
      "confirmedSettings": [
        "4",
        "5",
        "6"
      ],
      "excludedSettings": [
        "1",
        "2",
        "3"
      ],
      "color": "#FF9800"
    },
    {
      "id": "ed_voice_tatoe",
      "name": "ED中ボイス「たとえ誰に～」",
      "description": "エンディング中に幸太郎「たとえ誰に～」ボイスで設定5以上濃厚",
      "confirmedSettings": [
        "5",
        "6"
      ],
      "excludedSettings": [
        "1",
        "2",
        "3",
        "4"
      ],
      "color": "#E91E63"
    }
  ],
  "author": "コミュニティ",
  "version": "1.2",
  "description": "大都技研のスマスロAT機（ST型）。ST確率・CZ確率・ST直撃に設定差。徒花ボーナス中キャラ紹介で設定確定（サキ: 設定2以上、愛: 設定3以上、純子: 設定4以上、ゆうぎり: 設定5以上、リリィ: 設定6）。ED中ボイスで設定示唆。",
  "lastUpdated": "2026-03-25",
  "source": "ちょんぼりすた、一撃、DMMぱちタウン、ななプレス"
}
